{
  "type": "catalog-mailbox-key",
  "schemaVersion": 1,
  "pairIdHash": "65628a9e671c78cf2dd85ef5e9522f0bac3e6bb33ad4673ba8a4acf7e846b59f",
  "pairEpoch": 1,
  "receiveKeyId": "rKeyIDrKeyIDrKeyIDrKey",
  "ownerDeviceKeyId": "a1b2c3d4e5f6a1b2c3d4e5f6a1b2c3d4e5f6a1b2c3d4e5f6a1b2c3d4e5f6a1b2",
  "receivePublicKey": {
    "kty": "EC",
    "crv": "P-256",
    "x": "62O6DLPjQNPyMIJmcbA5NlTchtovEzaFP8eiB6x40cQ",
    "y": "rG5CJixxa3cWgTrTFEiSpZxecT-muaQUdQkheRPqCc0"
  },
  "createdAt": 1700002000,
  "signature": "ABCDEFGHIJKLMNOPQRSTUVWXYZabcdefghijklmnopqrstuvwxyz0123456789_-ABCDEFGHIJKLMNOPQRSTUV"
}
